{"schema_version": 1,
 "targets": [{"target": "src/plenum/graph.py::_graph_prefixes", "engine": "crosshair-diffbehavior", "engine_version": "0.0.111",
   "verdict": "PASS", "search_budget": {"iterations": 36, "per_condition_timeout_s": 10}, "generators": "typed_default", "typed": true,
   "domain_guard": null, "equivalence": "strict", "lines": [12, 40], "counterexample": null},
  {"target": "src/plenum/io.py::load", "engine": "crosshair-diffbehavior", "engine_version": "0.0.111",
   "verdict": "INCONCLUSIVE", "reason": "side effects on import", "search_budget": {"iterations": 0, "per_condition_timeout_s": 10},
   "generators": "typed_default", "typed": true, "domain_guard": null, "equivalence": "strict", "counterexample": null}],
 "out_of_scope": [], "error": null}
